{
  "schema": "tiangong.supabase-consumer-manifest.v3",
  "version": 3,
  "repository": "tiangong-lca/tiangong-cli",
  "baseCommit": "5cb359f1d0860df560c7571fa7547b2822b37c71",
  "headCommit": "5cb359f1d0860df560c7571fa7547b2822b37c71",
  "authority": {
    "status": "candidate",
    "authorizesDatabaseFreeze": false,
    "authorizesHostedMutation": false
  },
  "source": {
    "derivation": "typescript-compiler-ast-v1",
    "governedPatterns": [
      "src/**/*.ts",
      "scripts/**/*.ts",
      "bin/**/*.js"
    ],
    "exactExemptions": [
      "scripts/scan-data-api-consumers.ts"
    ],
    "treeDigestAlgorithm": "sha256(mode\\0path\\0blobOid\\0)",
    "treeDigest": "cd798cc2ef250f73eac4820f0c30ba14a72e4c195d43edf64c95bb151eb2baae",
    "fileCount": 119
  },
  "occurrences": [
    {
      "id": "cli-8b938639832a5a527beaeb5e",
      "file": "src/lib/dataset-command.ts",
      "line": 135,
      "span": {
        "startOffset": 3426,
        "endOffset": 3484,
        "startLine": 135,
        "startColumn": 10,
        "endLine": 135,
        "endColumn": 68,
        "sha256": "79075bb2ad07afd09b59da19477ab5311202432793a374283ca5bb5d0343f32d"
      },
      "operation": "edge-function.route",
      "transport": "edge-function",
      "credential": "authenticated-user-session",
      "schema": "edge-function",
      "object": "`${deriveSupabaseProjectBaseUrl(apiBaseUrl)}/functions/v1`",
      "signature": "`${deriveSupabaseProjectBaseUrl(apiBaseUrl)}/functions/v1`",
      "acl": "authenticated user token plus publishable key; no service-role",
      "semantics": "route-construction",
      "upstream": [
        "Edge Function lifecycle joint verification"
      ],
      "sourceClass": "typescript-ast"
    },
    {
      "id": "cli-a74587236cacdca9d4661b27",
      "file": "src/lib/dataset-maintenance-clear-account.ts",
      "line": 280,
      "span": {
        "startOffset": 7655,
        "endOffset": 7695,
        "startLine": 280,
        "startColumn": 15,
        "endLine": 280,
        "endColumn": 55,
        "sha256": "8f52fa689fe5c103432264e473b76a5c392549cf7e78918744f86fcb91b38fab"
      },
      "operation": "auth.route",
      "transport": "auth",
      "credential": "authenticated-user-session",
      "schema": "auth",
      "object": "`${options.projectBaseUrl}/auth/v1/user`",
      "signature": "`${options.projectBaseUrl}/auth/v1/user`",
      "acl": "authenticated user token plus publishable key; no service-role",
      "semantics": "session-validation",
      "upstream": [],
      "sourceClass": "typescript-ast"
    },
    {
      "id": "cli-b4176ffaa860bc0aa61bb161",
      "file": "src/lib/dataset-maintenance-clear-account.ts",
      "line": 327,
      "span": {
        "startOffset": 9022,
        "endOffset": 9112,
        "startLine": 327,
        "startColumn": 26,
        "endLine": 330,
        "endColumn": 9,
        "sha256": "fc8ccfba7978f17098ae4fd9f7e39fdac4f6d094df23f2b72499994adb147bbb"
      },
      "operation": "postgrest.relation",
      "transport": "postgrest",
      "credential": "authenticated-user-session",
      "schema": "public",
      "object": "contacts",
      "signature": "resolveDataApiCapability({\n        kind: 'relation',\n        name: options.table,\n      })",
      "acl": "authenticated-only; anon-deny; service-role-deny",
      "semantics": "capability-specific",
      "upstream": [],
      "sourceClass": "typescript-ast"
    },
    {
      "id": "cli-fed65a2351826665b7eb7936",
      "file": "src/lib/dataset-maintenance-clear-account.ts",
      "line": 327,
      "span": {
        "startOffset": 9022,
        "endOffset": 9112,
        "startLine": 327,
        "startColumn": 26,
        "endLine": 330,
        "endColumn": 9,
        "sha256": "fc8ccfba7978f17098ae4fd9f7e39fdac4f6d094df23f2b72499994adb147bbb"
      },
      "operation": "postgrest.relation",
      "transport": "postgrest",
      "credential": "authenticated-user-session",
      "schema": "public",
      "object": "flows",
      "signature": "resolveDataApiCapability({\n        kind: 'relation',\n        name: options.table,\n      })",
      "acl": "authenticated-only; anon-deny; service-role-deny",
      "semantics": "capability-specific",
      "upstream": [],
      "sourceClass": "typescript-ast"
    },
    {
      "id": "cli-830fd4cc64752cf1527427ff",
      "file": "src/lib/dataset-maintenance-clear-account.ts",
      "line": 327,
      "span": {
        "startOffset": 9022,
        "endOffset": 9112,
        "startLine": 327,
        "startColumn": 26,
        "endLine": 330,
        "endColumn": 9,
        "sha256": "fc8ccfba7978f17098ae4fd9f7e39fdac4f6d094df23f2b72499994adb147bbb"
      },
      "operation": "postgrest.relation",
      "transport": "postgrest",
      "credential": "authenticated-user-session",
      "schema": "public",
      "object": "lifecyclemodels",
      "signature": "resolveDataApiCapability({\n        kind: 'relation',\n        name: options.table,\n      })",
      "acl": "authenticated-only; anon-deny; service-role-deny",
      "semantics": "capability-specific",
      "upstream": [],
      "sourceClass": "typescript-ast"
    },
    {
      "id": "cli-0e02b8adb73671263ade84df",
      "file": "src/lib/dataset-maintenance-clear-account.ts",
      "line": 327,
      "span": {
        "startOffset": 9022,
        "endOffset": 9112,
        "startLine": 327,
        "startColumn": 26,
        "endLine": 330,
        "endColumn": 9,
        "sha256": "fc8ccfba7978f17098ae4fd9f7e39fdac4f6d094df23f2b72499994adb147bbb"
      },
      "operation": "postgrest.relation",
      "transport": "postgrest",
      "credential": "authenticated-user-session",
      "schema": "public",
      "object": "processes",
      "signature": "resolveDataApiCapability({\n        kind: 'relation',\n        name: options.table,\n      })",
      "acl": "authenticated-only; anon-deny; service-role-deny",
      "semantics": "capability-specific",
      "upstream": [],
      "sourceClass": "typescript-ast"
    },
    {
      "id": "cli-b55fb7234ddd08ac29077264",
      "file": "src/lib/dataset-maintenance-clear-account.ts",
      "line": 327,
      "span": {
        "startOffset": 9022,
        "endOffset": 9112,
        "startLine": 327,
        "startColumn": 26,
        "endLine": 330,
        "endColumn": 9,
        "sha256": "fc8ccfba7978f17098ae4fd9f7e39fdac4f6d094df23f2b72499994adb147bbb"
      },
      "operation": "postgrest.relation",
      "transport": "postgrest",
      "credential": "authenticated-user-session",
      "schema": "public",
      "object": "sources",
      "signature": "resolveDataApiCapability({\n        kind: 'relation',\n        name: options.table,\n      })",
      "acl": "authenticated-only; anon-deny; service-role-deny",
      "semantics": "capability-specific",
      "upstream": [],
      "sourceClass": "typescript-ast"
    },
    {
      "id": "cli-d1420c966e67b80c197537e1",
      "file": "src/lib/dataset-maintenance-remote.ts",
      "line": 251,
      "span": {
        "startOffset": 7814,
        "endOffset": 7846,
        "startLine": 251,
        "startColumn": 10,
        "endLine": 251,
        "endColumn": 42,
        "sha256": "16733166222c9fea0879bc37e84da72da2917107a66194f09f3105be746c941e"
      },
      "operation": "auth.route",
      "transport": "auth",
      "credential": "authenticated-user-session",
      "schema": "auth",
      "object": "`${projectBaseUrl}/auth/v1/user`",
      "signature": "`${projectBaseUrl}/auth/v1/user`",
      "acl": "authenticated user token plus publishable key; no service-role",
      "semantics": "session-validation",
      "upstream": [],
      "sourceClass": "typescript-ast"
    },
    {
      "id": "cli-82b9a11fa3dfd39eba8b78e6",
      "file": "src/lib/dataset-maintenance-remote.ts",
      "line": 550,
      "span": {
        "startOffset": 18456,
        "endOffset": 18508,
        "startLine": 550,
        "startColumn": 5,
        "endLine": 550,
        "endColumn": 57,
        "sha256": "14048172eff7883ce34afd736b03b8bc903347b36551f43c877e4e873afa9693"
      },
      "operation": "postgrest.rpc",
      "transport": "postgrest",
      "credential": "authenticated-user-session",
      "schema": "profile-selected",
      "object": "cmd_dataset_alias_execution_preflight_guarded",
      "signature": "rpc: 'cmd_dataset_alias_execution_preflight_guarded'",
      "acl": "authenticated-only; anon-deny; service-role-deny",
      "semantics": "capability-specific",
      "upstream": [
        "tiangong-lca/database-engine#357"
      ],
      "sourceClass": "typescript-ast"
    },
    {
      "id": "cli-07ae57105aee44472a08e0ab",
      "file": "src/lib/dataset-maintenance-remote.ts",
      "line": 562,
      "span": {
        "startOffset": 18814,
        "endOffset": 18862,
        "startLine": 562,
        "startColumn": 5,
        "endLine": 562,
        "endColumn": 53,
        "sha256": "6da22a53aa45a45fdf9505455376b6dbafe1b36fda3422bcf40acaee3a432b24"
      },
      "operation": "postgrest.rpc",
      "transport": "postgrest",
      "credential": "authenticated-user-session",
      "schema": "profile-selected",
      "object": "cmd_dataset_alias_execution_admit_guarded",
      "signature": "rpc: 'cmd_dataset_alias_execution_admit_guarded'",
      "acl": "authenticated-only; anon-deny; service-role-deny",
      "semantics": "capability-specific",
      "upstream": [
        "tiangong-lca/database-engine#357"
      ],
      "sourceClass": "typescript-ast"
    },
    {
      "id": "cli-d3f693819ed7c9a546ab56a1",
      "file": "src/lib/dataset-maintenance-remote.ts",
      "line": 576,
      "span": {
        "startOffset": 19281,
        "endOffset": 19328,
        "startLine": 576,
        "startColumn": 5,
        "endLine": 576,
        "endColumn": 52,
        "sha256": "366d57c62c2c3defb3221985a49a467b48197f2365ed99b14495c7749d415f50"
      },
      "operation": "postgrest.rpc",